questions,level,category,product,option_a,option_b,option_c,option_d,correct_option
What is the primary function of Fiddes Hard Wax Oil?,1,Brand,Fiddes,"To provide a protective, durable finish while enhancing the natural beauty of wood","To create a glossy, synthetic layer that completely seals the wood",To make wood surfaces highly reflective and shiny,To permanently stain wood in a specific color,"To provide a protective, durable finish while enhancing the natural beauty of wood"
How long does it take Fiddes hard wax oil to dry? ,2,Brand,Fiddes,4 hours,10 hours,3 hours,1 hour,4 hours
How can I tell if my floor needs another coat of the Fiddes hard wax oil? ,4,Brand,Fiddes,Do an oil test ,Do a water test ,Test the moisture content,Always sand fully and back and apply 1 coat ,Do an oil test 
"The coverage on Fiddes supreme wax polish is 10m2 perL, how much will a 400ml do for one coat? ",2,Brand,Fiddes,4m2,1m2,10m2,8m2 ,4m2
What is the primary function of Barrettine Wood Preserver?,1,Brand,Barrettine,"To protect wood from rot, decay, and fungal growth","To create a glossy, decorative finish on wood surfaces",To seal the wood from the elements,To give timber an opaque paint finish ,"To protect wood from rot, decay, and fungal growth"
Can Barrettine Premier Preserver be applied to damp wood?,1,Brand,Barrettine,"No, the wood needs to be dry before treatment","Yes, you can apply the product to damp timber",Yes as long as its not due to rain ,No but you can apply it whilst its raining ,"No, the wood needs to be dry before treatment"
Can I use a water based paint over the Barrettine Premier Preserver after a year?,3,Brand,Barrettine,No the wax content will stop the paint adhering,"Yes, you can paint over in a year",Yes but you need to wipe over with meths first ,"No, you cant put anything over the Barrettine premier wood preserver ",No the wax content will stop the paint adhering
Can you use Barrettine wood protective treatment to seal untreated wood?,3,Brand,Barrettine,No you need to use a wood preserver first,Yes its perfect to go straight on bare wood,No you need to paint the surface first ,Yes but you need to use the coloured version first,No you need to use a wood preserver first
Can Barrettine All-In-One Decking Oil be used on wood previously painted with a wood primer?,2,Brand,Barrettine,No it will not be able to soak in,"Yes, this is what is recommended",You can but you do not need to use a primer first,Only if you do 3 coats of the oil ,No it will not be able to soak in
Which of the following is a key feature of Crown’s Trade Matt Emulsion?,2,Brand,Crown,High-opacity finish,High-gloss shine,Quick-drying formula,Waterproof protection,High-opacity finish
Crown’s Trade Full Gloss provides a high-gloss finish. What is one of its key features?,4,Brand,Crown,Durability and long-lasting finish,Quick-drying formula,Matt finish ,Low VOC content ,Durability and long-lasting finish
Liberon Finishing Oil is designed to do what?,1,Brand,Liberon,"Nourish and protect wood, giving it a durable water resistant finish",Remove stains from wood surfaces,"Provide a high-gloss, lacquered finish",Enhance the wood's colour with a tinted varnish,"Nourish and protect wood, giving it a durable water resistant finish"
What precautions would you need when using the Liberon floor cleaner?,3,Brand,Liberon,Wear PPE and ventilate the area,Make sure you netrualise the wood after,No special precautions needed,Just wear an apron,Wear PPE and ventilate the area
What is Liberon retouch cream designed to do?,3,Brand,Liberon,Filling metre joints and pin holes,Moisterise the wood,Stains and seals the wood,It acts like a reviver gel to bleach the wood ,Filling metre joints and pin holes
What makes Manns trade bar top lacquer suitable for bar tops? ,2,Brand,Manns ,Chemical resistance,Heat resistance,Slip resistance,Food safety ,Chemical resistance
Whats the only finish the Manns premier door oil comes in?,2,Brand,Manns ,Matt,Satin ,Semi matt ,High gloss ,Matt
How would you describe the C600 colour in Manns classic pine stain?,5,Brand,Manns ,A light to medium brown hue with a colder undertone,A dark red with a brown undertone,A warm bright yellow with a orange undertone,A very dark ebonised finish ,A light to medium brown hue with a colder undertone
What do Morrells recommend you do not do when applying their varnishes?,5,Brand,Morrells,Apply more than 3 coats in a day,Use a sprayer,Ventilate the area,Wear PPE ,Apply more than 3 coats in a day
How many coats of Morrells nitrocellulose lacquer is needed?,3,Brand,Morrells,3 to 9 ,1 to 2 ,4 to 20 ,3 to 11,3 to 9 
What would you usually recommend Protek wood stain and protect for?,2,Brand,Protek,"Childrens play areas, or sheds and fences",Decking and window sills,Interior flooring and worktops,Sleepers and untreated fencing ,"Childrens play areas, or sheds and fences"
"What is the moisture content of wood considered to be in a ""dry"" state?",2,Wood,Moisture,Below 20% ,Below 10%,Below 15%,Below 5%,Below 20% 
What is the impact of drying wood too quickly on its moisture content?,3,Wood,Moisture,"It can cause surface cracking, warping, and internal stresses due to uneven drying",It helps the wood retain more moisture,It prevents the wood from losing too much moisture,It speeds up the process of stabilizing the moisture content,"It can cause surface cracking, warping, and internal stresses due to uneven drying"
What is plaster primarily used for in construction?,2,General K,Plaster,To create smooth surfaces on walls and ceilings,To waterproof exterior foundations,To give walls and ceilings a textured finish,To insulate buildings,To create smooth surfaces on walls and ceilings
What is Accoya wood primarily known for?,1,Wood,Accoya,Its enhanced durability and resistance to rot,Its lightweight properties and flexibility,Its resistance to extreme heat and fire,Its ability to absorb water and swell,Its enhanced durability and resistance to rot
How does Accoya wood compare to traditional softwoods like pine?,5,Wood,Accoya,"Accoya is more durable, stable, and resistant to rot and decay",Accoya is softer and more prone to damage from insects,Accoya is lighter and easier to work with than pine,Accoya has a shorter lifespan than traditional softwoods,"Accoya is more durable, stable, and resistant to rot and decay"
Can Accoya wood be painted or stained?,3,Wood,Accoya,"Yes, it takes paint and stain very well due to its smooth surface and low moisture content","No, it cannot be painted or stained due to its high resin content","Yes, but it requires special paint that is only available in certain colours","No, it must remain untreated to preserve its natural look","Yes, it takes paint and stain very well due to its smooth surface and low moisture content"
What is a common application of Tricoya wood in construction?,4,Wood ,Tricoya,Exterior cladding and facades due to its enhanced durability and resistance to moisture and decay,Internal drywall for partition walls,Structural beams and load-bearing columns,Flooring in high-traffic areas,Exterior cladding and facades due to its enhanced durability and resistance to moisture and decay
What is the dimensional stability of Tricoya wood like?,4,Wood ,Tricoya,"Tricoya wood has excellent dimensional stability, meaning it is highly resistant to swelling, shrinking, and warping, even in changing humidity and moisture conditions",Tricoya wood has poor dimensional stability and tends to warp and shrink significantly in varying humidity.,"Tricoya wood has average dimensional stability, similar to untreated softwoods, and requires frequent maintenance","Tricoya wood has high dimensional stability but only when exposed to extreme heat, not moisture","Tricoya wood has excellent dimensional stability, meaning it is highly resistant to swelling, shrinking, and warping, even in changing humidity and moisture conditions"
What type of wood is commonly used to produce Thermowood?,4,Wood,Thermowood,"Softwoods such as pine, spruce, and fir are commonly used to produce Thermowood",Hardwoods such as oak and mahogany are primarily used to produce Thermowood,Bamboo is the most common material used to create Thermowood,Only tropical hardwoods are used to produce Thermowood,"Softwoods such as pine, spruce, and fir are commonly used to produce Thermowood"
How does Thermowood compare to untreated wood in terms of dimensional stability?,4,Wood,Thermowood,"Thermowood has significantly improved dimensional stability, meaning it is less likely to shrink, swell, or warp when exposed to moisture compared to untreated wood",Thermowood has the same dimensional stability as untreated wood and behaves similarly when exposed to moisture,"Thermowood has poorer dimensional stability than untreated wood, and it is more prone to swelling and shrinking","Thermowood is highly flexible, while untreated wood is rigid and more prone to cracking.","Thermowood has significantly improved dimensional stability, meaning it is less likely to shrink, swell, or warp when exposed to moisture compared to untreated wood"
What does abrade mean?,1,General K,,Light sand,Heavy sand,Wiping off excess oil,Wiping off excess varnish ,Light sand
What does polymerised mean?,2,General K,,Binding of chemicals,Seperation of chemicals,The hard substance in a varnish,The hard substance in an  oil,Binding of chemicals
What base is Morrells light fast wood stain?,1,Brand,Morrells,Solvent ,Oil,Water,Polyurethane,Solvent 
What is the Osmo intensive cleaner used for?,2,Brand,Osmo ,A pre treatment for removing dirt and stains,To remove all traces of oil,To revive grey timber ,To clean black water marks,A pre treatment for removing dirt and stains
"I have a shed that’s 6ft (h) x 5ft (l) and 4ft (w), how many squared feet do I have?",2,General K,,108,107,98,110,108
What type of paint can tend go yellow over time? ,2,Product type,Paint,Solvent ,Vinyl,Water,Acrylic  ,Solvent 
"If someone is painting their raised beds, what else can they do for extra protection against moisture?",3,General K,,Add a damp proof membrane ,Add a adhesive ,Add a wood hardener to the timber,Treat with mould and mildew cleaner ,Add a damp proof membrane 
What chemical is found in exterior products that is not good for internal use? ,2,General K,,Biocides,Toulene,Solvent  ,Cellulose,Biocides
What type of sheen is hard for paint to bond to? ,4,General K,,Gloss,Satin,Matt,Semi matt,Gloss
What is a tack cloth used for?,1,Application,,Removing dust and debris from surfaces before painting or finishing.,Polishing metal surfaces,Measuring paint thickness,Smoothing out rough edges on wood,Removing dust and debris from surfaces before painting or finishing.
" A log cabin has a rectangular floor with dimensions of 8 meters by 12 meters. The walls of the cabin are made from logs that are 0.25 meters in diameter and are stacked vertically to a height of 3 meters. If the logs are stacked side by side, what is the total length of the logs used for the four walls of the cabin?",5,General K,Measurements,96 meters,96.5 meters,100 meters,106 meters,96 meters
Which of the following is a common consequence of owning a listed building?,2,General K,,"Owners must adhere to strict guidelines for repair, maintenance, and alteration to preserve the building’s character","Owners are responsible for restoring the building to its original state, regardless of cost",Owners must sell the property to the government if they no longer want to maintain it,Owners are usually provided with tax breaks to cover maintenance costs,"Owners must adhere to strict guidelines for repair, maintenance, and alteration to preserve the building’s character"
What does self levelling mean?,3,General K,,Self levelling refers to a material that spreads out to form a smooth level surface,Self levelling is a technique used to make paint dry faster by applying heat,Self-levelling refers to a method of training animals to balance on uneven surfaces.,Self-levelling is a process in which water levels automatically adjust in rivers without any external factors.,Self levelling refers to a material that spreads out to form a smooth level surface
A customer has used Peelaway 1 and it has made their wood go black. Why could this be? ,5,Brand,Peelaway,They have used it on Oak ,They have used it on Pine,They have used it on the wrong paint type ,They used it on Mahogany ,They have used it on Oak 
What makes wood spalted? ,4,Wood,Spalted,Fungal growth that creates distinctive patterns in the wood,Exposure to sunlight for long periods,Being soaked in water for several weeks,Heating the wood to high temperatures,Fungal growth that creates distinctive patterns in the wood
What is a common method for stabilizing spalted wood before using it in woodworking projects?,5,Wood,Spalted,Treating the wood with a stabilizing resin or epoxy to harden it,Freezing the wood to prevent further fungal growth,Exposing the wood to high heat to kill the fungi,Soaking the wood in water for a week,Treating the wood with a stabilizing resin or epoxy to harden it
What is a scrub 1 rating? ,3,General K,Paint ,The highest level of scrub resistance in a paint or coating,The lowest level of scrub resistance in a paint or coating,If a product is scrubbed once it will wear off ,The level of slip resistance in a product,The highest level of scrub resistance in a paint or coating
What are the characteristics of ‘green’ timber?,2,General K,,Wet and high moisture content,Dry and ready to treat,Ridden with woodworm,Susepible to rotting ,Wet and high moisture content
