questions,level,category,product,option_a,option_b,option_c,option_d,correct_option
Farrow & Ball paints are primarily made with which type of pigment?,2,Brand,Farrow and ball,Natural pigments,Synthetic pigments,Chalk-based pigments,Fluorescent pigments,Natural pigments
"What is a key difference between Farrow & Ball's ""Estate Emulsion"" and ""Modern Emulsion""?",4,Brand,Farrow and ball," ""Modern Emulsion"" is more durable and suitable for high-traffic areas","""Estate Emulsion"" is only available in dark colors","""Modern Emulsion"" is a water-based gloss paint","""Estate Emulsion"" is for use on exterior surfaces"," ""Modern Emulsion"" is more durable and suitable for high-traffic areas"
"Which wood has a distinctive reddish-brown color and is often used in fine furniture making, particularly in veneers?",2,Wood,Colour,Rosewood,Ash,Elm,Birch,Rosewood
Which of these wood finishes is ideal for use on hardwoods in exterior applications with a protective and semi translucent finish?,3,Brand ,Sikkens,Sikkens Cetol HLS,Sikkens Satura,Sikkens TSI Satin,Sikkens Rubbol Gloss,Sikkens Cetol HLS
"Sadolin’s ""Sadolin Clearcoat"" is designed to provide which of the following?",3,Brand ,Sadolin ,A protective  finish for exterior wood with UV protection,A coloured finish for garden furniture,A clear varnish that preserves and seals in one ,A high-gloss finish for wooden floors,A protective  finish for exterior wood with UV protection
What type of paint is Earthborn known for?,1,Brand ,Earthborn,"Water-based, low VOC paints","Oil-based, high gloss paints",Acrylic paints,"Solvent-based, enamel paints","Water-based, low VOC paints"
What percentage of sheen should a satin have?,2,General K,Sheen,40%,30%,70%,90%,40%
What is mortar?,4,General K,,"A mixture of sand, water, and cement used to bind bricks, stones, or concrete blocks together",A type of wood adhesive used for joining pieces of timber in carpentry, A chemical solution used to paint concrete surfaces for a smooth finish.,A form of plaster used for creating textured wall finishes in interior design.,"A mixture of sand, water, and cement used to bind bricks, stones, or concrete blocks together"
What is a tack rag used for?,1,Application,,"To remove dust, dirt, and debris from surfaces before painting or finishing to ensure a smooth, clean finish",To apply the final layer of paint to a surface for a high-gloss finish,To wipe off excess paint or stain from a surface during application,"To polish furniture and create a shiny, smooth surface","To remove dust, dirt, and debris from surfaces before painting or finishing to ensure a smooth, clean finish"
What is the purpose of filling wood?,1,Product type,Filler,"To fix gaps, cracks and holes",To add colour to a surface,Improve wood integrity ,To add UV protection ,"To fix gaps, cracks and holes"
What should be done if wood filler shrinks after drying?,2,Product type,Filler,Apply a second layer of filler,Leave the shrinkage as is ,Apply a coat of paint immediately ,Dig it all out and start again ,Apply a second layer of filler
"If a paint can is labeled ""enamel,"" what does that typically mean about the paint?",2,Product type,Paint,"It is durable and has a hard, glossy finis",It is meant for indoor use only.,It is made from a synthetic polymer.,It’s a water based paint ,"It is durable and has a hard, glossy finis"
Which of the following is a common reason for paint to peel off a surface?,2,Product type,Paint,Improper surface preparation or contamination,Using a brush instead of a roller,Applying paint in too many coats.,Choosing a paint color that is too dark,Improper surface preparation or contamination
Polyvine wood finishes are known for being?,1,Brand,Polyvine,Water-based and quick-drying,Oil-based ,Acidic and harmful to wood,Highly flammable,Water-based and quick-drying
Which of the following is a common use for white spirit in household maintenance?,1,General K ,W spirit,Cleaning paintbrushes after using oil-based paints,Polishing furniture,Removing grease from kitchen surfaces,Deodorizing carpets,Cleaning paintbrushes after using oil-based paints
What is the correct thinners for Morrells 250 pre catalyst lacquer? ,4,Brand,Morrells,Morrells cellulose thinners,Morrells hydrocarbon free thinners,Morrells equiptment cleaner,Morrells light fast thinners ,Morrells cellulose thinners
Which of the following surfaces is PeelAway safe to use on?,4,Brand,Peelaway,"Wood, masonry, and metal",Fabric and carpets,"wood, glass and ceramic",Leather and plastics,"Wood, masonry, and metal"
How does PeelAway handle multi-layered paint removal differently from many other paint removal products?,3,Brand,Peelaway,It can remove several layers at once without damaging the underlying substrate,It works by creating a chemical reaction that dissolves all layers simultaneously,It requires reapplication every hour for effective results,"It removes only the topmost layer, leaving others intact for a second round",It can remove several layers at once without damaging the underlying substrate
"Someone wants to use Cuprinol garden shades but need a wood preserver first, what one would you recommend? ",3,General K,Scenario,Cuprinol wood preserver clear,Barrettine premier wood preservative,Ronseal total wood preserver green,Barrettine wood protective treatment ,Cuprinol wood preserver clear
What is the primary purpose of Ronseals decking cleaner and reviver product?,2,Brand,Ronseal ,To revive and restore old dirty timber,To protect wooden surfaces from UV damage,To fill cracks and gaps in exterior wood,To create a gloss finish on all wood types,To revive and restore old dirty timber
"Zinsser ""Bin"" Shellac-Based Primer is known for its exceptional stain-blocking ability. Which of the following surfaces is it most effective at blocking stains from?",3,Brand,Zinsser,"Water, smoke and nicotine",Alkaline stains,Lead based paint and graffiti ,Old peeling paint stains,"Water, smoke and nicotine"
"Which of the following features makes Rust-Oleum ""Painter’s Touch Ultra Cover"" spray paint ideal for both indoor and outdoor use?",3,Brand,Rustoleum,It contains an acrylic resin that resists UV degradation,It is specifically designed to adhere only to porous surfaces,It uses a water-based formula that cures through evaporation,It provides a low-gloss finish suitable for heavy-duty applications,It contains an acrylic resin that resists UV degradation
Which of the following is a primary material used in the production of MDF?,2,Wood,Engineered,Wood fibers and resin,Steel and wood shavings,Recycled plastic and paper,Long sheets of veneer,Wood fibers and resin
What is the primary reason that plywood typically performs better than solid wood in resisting expansion and contraction due to humidity?,4,Wood,Engineered,"The layers of plywood have a cross-grain construction, which minimizes dimensional changes","Plywood is made from softwood, which naturally resists moisture changes","The adhesive used in plywood prevents moisture absorption, ensuring stability",Plywood is laminated with thin layers of solid wood that are more stable,"The layers of plywood have a cross-grain construction, which minimizes dimensional changes"
What does OSB stand for?,1,Wood,Engineered,Oriented Strand Board,Organic Striped Board,Old Structural Board,Overlaid Strand Binder,Oriented Strand Board
Which of the following is a disadvantage of OSB when compared to plywood?,2,Wood,Engineered,OSB is more prone to warping and swelling when exposed to moisture,OSB is more durable for long-term outdoor use,OSB has a more aesthetically pleasing surface for finishing,OSB can be used for heavy structural beams,OSB is more prone to warping and swelling when exposed to moisture
What two Protek products are the same just marketed differently?,2,Brand,Protek,Protek royal interior stain and Protek royal exterior stain,Protek stable coat and Protek eco shield,Protek royal interior paint and Protek royal exterior stain,Protek wood preserver ++ and Protek eco shield,Protek royal interior stain and Protek royal exterior stain
Protek wood finishes are designed to protect wood from a variety of external factors. Which of the following is NOT typically one of these protective properties?,3,Brand,Protek,Anti-static properties to prevent dust accumulation,UV resistance to prevent wood fading,Water resistance to prevent swelling and warping,Resistance to fungal and mold growth,Anti-static properties to prevent dust accumulation
Protek’s exterior wood finishes are designed to be durable under harsh weather conditions. Which of the following would be an example of a failure mode when applying Protek wood finishes to outdoor furniture in a coastal environment?,4,Brand,Protek,The finish may break down more quickly due to prolonged exposure to saltwater and high humidity,The finish would chip off quickly due to low temperatures in coastal areas,The finish will cause the wood to swell excessively and form bubbles on the surface,"The finish would enhance the wood’s resistance to insects and pests, even in coastal conditions",The finish may break down more quickly due to prolonged exposure to saltwater and high humidity
Which of the following is a common use of bamboo in construction and wood products?,1,Wood,Bamboo,"As flooring, furniture, and paneling",As a material for creating textiles,As a natural substitute for stone in heavy structural applications,As a synthetic alternative to plastic,"As flooring, furniture, and paneling"
Bamboo is often processed into engineered wood products like plywood. What is the main advantage of using bamboo plywood?,4,Wood,Bamboo,It is lighter and stronger than most hardwood plywood,It is harder to work with than other materials,It is more expensive than traditional plywood due to its rarity,It has a smoother finish than traditional plywood,It is lighter and stronger than most hardwood plywood
Which of the following is a key feature of Repair Care's repair systems?,2,Wood,Repaircare,They are suitable for both interior and exterior wood repairs,They provide a glossy finish only for aesthetic purposes,They do not require mixing,They are designed only for new wood,They are suitable for both interior and exterior wood repairs
What wood are log cabins generally made from? ,2,General K,Wood,Spruce,Teak,Mahogany,Iroko,Spruce
Which type of cedar wood is most commonly used for making outdoor furniture?,2,Wood,Cedar,Western Red Cedar,Eastern Red Cedar,Alaskan Yellow Cedar,Cedar of Lebanon,Western Red Cedar
What is one downside of cedar wood in terms of its physical properties?,3,Wood,Cedar,Softness and susceptibility to dents,Low cost,High density,Low resistance to moisture,Softness and susceptibility to dents
"Cedar wood is considered a softwood, but how does its density typically compare to other softwoods like pine?",4,Wood,Cedar,Cedar is less dense than pine,Cedar is denser than pine,Cedar and pine have the same density.,Cedar is the densest of all softwoods,Cedar is less dense than pine
Which of the following is a characteristic of pine wood?,1,Wood,Softwood,Light in colour and relatively soft,Very dark in color and hard,Dense and heavy,Highly resistant to rot and insects,Light in colour and relatively soft
What is the primary reason pressure treated pine wood is often used for outdoor furniture and decking?,2,Wood,Softwood,It is treated with preservatives to resist decay and insects,It naturally resists all weather conditions,It is naturally waterproof,It requires no maintenance or treatment over time,It is treated with preservatives to resist decay and insects
What is iroko wood primarily used for?,2,Wood,Hardwood,"Furniture, flooring, and boat building",Paper production,Carving sculptures,Packaging materials,"Furniture, flooring, and boat building"
What is the scientific name of iroko wood?,5,Wood,Hardwood,Milicia excelsa,Tectona grandis,Quercus robur,Quercus robur,Milicia excelsa
Which chemical property of iroko wood can pose a risk when working with it?,5,Wood,Hardwood,The wood contains compounds that can cause skin irritation or respiratory issues during prolonged exposure,The wood contains high levels of tannins that cause it to be highly toxic when burned,The wood contains strong acids that corrode metal tools,The wood releases a volatile compound that is highly flammable in certain conditions,The wood contains compounds that can cause skin irritation or respiratory issues during prolonged exposure
What is the typical colour of freshly cut idigbo wood?,4,Wood,Hardwood,Pale yellow to light brown,Dark red to reddish-brown,Light grey to white,Golden-yellow with dark streaks,Pale yellow to light brown
What is the scientific name of the tree species that produces idigbo wood?,5,Wood,Hardwood,Terminalia ivorensis,Tectona grandis,Quercus robur,Picea abies,Terminalia ivorensis
What is the primary effect of raised grain on the appearance of wood?,5,Wood,Grain,"It causes the wood surface to feel rough and uneven, affecting the smoothness of the finish.","It creates a glossy, smooth finish on the wood","It enhances the natural color of the wood, making it appear richer",It makes the wood surface more resistant to moisture,"It causes the wood surface to feel rough and uneven, affecting the smoothness of the finish."
Which of the following is the primary reason raised grain tends to be more prominent in coarse-grained hardwoods compared to fine-grained hardwoods?,5,Wood,Grain,"Coarse-grained woods have larger fibers that absorb moisture more readily, causing them to swell and raise more easily.","Coarse-grained woods have lower moisture content, which prevents raised grain","Fine-grained woods have more moisture content, which makes them more prone to raised grain","The tannin content in coarse-grained woods interacts with moisture, preventing raised grain","Coarse-grained woods have larger fibers that absorb moisture more readily, causing them to swell and raise more easily."
Which sandpaper grit is typically used for smoothing wood before applying a varnish finish?,1,Preparation,Sanding,180,40,60,120,180
"Why is it important to use progressive sanding grits (e.g., 80, 150, 220) when finishing wood?",3,Preparation,Sanding,"Using progressively finer grits ensures the removal of scratches left by coarser grits, resulting in a smoother, more refined surface for finishing.","It helps to create deeper scratches, which enhances the texture of the wood","It makes the wood more porous, allowing stains and finishes to absorb better",It eliminates the need for sanding with finer grits after the initial sanding,"Using progressively finer grits ensures the removal of scratches left by coarser grits, resulting in a smoother, more refined surface for finishing."
What type of sanding machine is typically used for smoothing large flat surfaces?,2,Preparation,Sanding,Drum sander,Belt sander,Random orbital sander,Detail sander,Drum sander
Which sanding machine is typically used for sanding edges and small curved areas in woodworking?,3,Preparation,Sanding,Oscillating spindle sander,Belt sander,Random orbital sander,Disk sander,Oscillating spindle sander
Which of the following factors can cause wood to warp?,2,Wood,,Excessive moisture absorption on one side,"Exposure to constant, even humidity",Regular temperature fluctuations,Proper drying techniques,Excessive moisture absorption on one side
"What is ""bowing"" in the context of wood warping?",2,Wood,,When the edges of a board curve up or down,When the wood twists along its length,When the surface of the wood becomes uneven due to improper sanding,When the wood becomes too brittle to work with,When the edges of a board curve up or down
"What is the purpose of a ""chiseled"" edge on a paintbrush?",2,Application,Brush,"To help the brush create sharp, clean lines along edges",To improve brush durability,To create a textured finish on the surface,To allow the brush to hold more paint,"To help the brush create sharp, clean lines along edges"
How can you prevent grain reversal when sanding wood?,4,,,Sand in the direction of the wood grain,Always use a coarse grit sandpaper,Sand across the grain to avoid grain lifting,Apply a thick coat of finish before sanding,Sand in the direction of the wood grain
What Bona product can you use over the Bona craft oil 2k for more durability?,2,Brand,Bona,Bona Traffic HD  ,Bona classic UX primer,Bona mega ,Bona mega evo ,Bona Traffic HD  
What is the purpose of Bona Polish for hardwood floors?,1,Brand,Bona,To restore shine and provide a protective layer,To clean grout and tile,To treat leather furniture,To fully protect wood surfaces,To restore shine and provide a protective layer
Which Bona product is designed to repair and fill gaps in between long floor boards?,1,Brand,Bona,Bona Gap Master,Bona Floor Cleaner,Bona mix and fill plus,Bona Stain Remover,Bona Gap Master
Bona’s hard surface cleaner is designed for use on what type of surfaces?,1,Brand,Bona,"Stone, tile, and laminate floors",Wooden flooring,Leather upholstery,Wooden worktops,"Stone, tile, and laminate floors"
Which surface is most suitable for applying distemper?,3,Product type,Paint,Dry plaster or unpainted walls,Glossy wooden panels,Metal surfaces,Glossy ceramic tiles,Dry plaster or unpainted walls
Which of the following surfaces is most suitable for applying limewash?,4,Product type,Paint,Unfinished plaster or brick,Glossy metal,Smooth plastic,Glossy wood panels,Unfinished plaster or brick
What color is limewash typically available in?,3,Product type,Paint,"Mostly white, with muted earthy tones",Only in shades of red and blue,A wide range of bright colours,Only black,"Mostly white, with muted earthy tones"
What is the main concept behind the technique of colour drenching in interior design?,3,Product type,Paint,Applying a single colour to all surfaces in a room for a cohesive look,Using multiple contrasting colours in a room,Using bright neon colors for accent walls,Combining natural materials like wood and stone for a rustic feel,Applying a single colour to all surfaces in a room for a cohesive look
"In colour drenching, which of the following is NOT a recommended technique to avoid making the room feel flat or monotonous?",4,Product type,Paint,Incorporating furniture pieces in contrasting colors to break up the tone,"Varying the finish on different surfaces (matte for walls, gloss for trim)","Using a single hue for walls, trim, and ceiling",Adding texture through wall treatments like plaster or fabric,Incorporating furniture pieces in contrasting colors to break up the tone
What type of finish does Craig & Rose’s “Chalky Finish” paint offer?,2,Brand,Craig and rose,"A smooth, flat matte finish",Glossy and reflective,A semi-gloss finish,"A textured, semi transparent look","A smooth, flat matte finish"
What are Manns best known for?,1,Brand,Manns,"Mostly water based, cost effective stains, oils and varnishes",Solvent based paints and oils ,Strictly interior brand,Strictly exterior brand,"Mostly water based, cost effective stains, oils and varnishes"
What is best to apply Manns stain with?,1,Brand,Manns,Sponge,Brush,Roller,Trowel,Sponge
"If you had red Manns classic wood dye, and wanted to make purple, what colour would you add? ",2,Brand,Manns ,Blue,Yellow  ,White,Green,Blue
What is Polyvine best known for producing?,1,Brand,Polyvine,Varnishes and decorative coatings,Electrical components,Preservers and paints,Cooking products,Varnishes and decorative coatings
Which Polyvine varnish has the most heat resistance? ,3,Brand,Polyvine,Polyvine heavy duty extreme varnish ,Polyvine decorators varnish ,Polyvine wax finish varnish,Polyvine crackle glaze,Polyvine heavy duty extreme varnish 
What zinsser product is best for covering graffiti?,3,Brand,Zinsser,Zinsser B-I-N,Zinsser Perma white ,Zinsser all coat WB,Zinsser Gardz,Zinsser B-I-N
How should brushes with Zinsser BIN on be cleaned after use?,2,Brand,Zinsser, B-I-N brush cleaner and restorer,Water,Cellulose,Meths, B-I-N brush cleaner and restorer
Can Zinsser All Coat Exterior be used on surfaces that are exposed to harsh weather?,3,Brand,Zinsser,"Yes, it is specially formulated for exterior use and provides long-lasting protection against harsh weather","No, it is only suitable for interior use and should not be exposed to rain or sunlight","Yes, but only if the weather is mild and dry, as it cannot withstand extreme conditions","No, it is only designed for indoor surfaces and will deteriorate quickly in harsh weather","Yes, it is specially formulated for exterior use and provides long-lasting protection against harsh weather"
Zinsser Bulls Eye 1-2-3 is best applied with?,3,Brand,Zinsser,Brush or roller,Sprayer,Sponge,Cloth ,Brush or roller
What is Dulux Paint primarily used for?,1,Brand,Dulux,"For colouring and protecting interior and exterior walls, doors, and trims",To create high-gloss finishes on metal surfaces only,To coat wooden furniture and prevent termites,To provide a textured surface for flooring installations,"For colouring and protecting interior and exterior walls, doors, and trims"
Dulux offers a specific range for which of the following?,1,Brand,Dulux,"High-traffic areas, with enhanced stain resistance",Only outdoor industrial equipment,Only for outdoor decorative items,For only specialised commercial buildings,"High-traffic areas, with enhanced stain resistance"
"What is a major advantage of Dulux's ""Easycare"" range of paints?",3,Brand,Dulux,"They are highly resistant to stains and marks, making them ideal for busy households",They have an extremely glossy finish that resists smudges,They feature a water-based formula suitable for use on metal only,They come only in pastel shades,"They are highly resistant to stains and marks, making them ideal for busy households"
"Dulux ""Trade"" Matt Emulsion is known for its opacity. What feature of this paint contributes to its superior opacity?",4,Brand,Dulux,It is made from high-quality pigments and resins that ensure fewer coats are needed for full coverage,It contains a unique mix of thinners that help the paint cover better,"It dries faster, allowing the surface to appear opaque within minutes","It is designed with a thicker texture, which can make it harder to apply in thin layers",It is made from high-quality pigments and resins that ensure fewer coats are needed for full coverage
"What is a key benefit of Sandtex Trade ""Masonry Paint"" for exterior surfaces?",2,Brand,Sandtex,It is water-based and provides long-lasting protection against harsh weather,It is only available in white,It is not suitable for use in coastal regions,It requires multiple coats for full coverage and durability,It is water-based and provides long-lasting protection against harsh weather
"Sandtex Trade ""Masonry Paint"" offers resistance to environmental factors. What specific formulation feature of Sandtex Trade ""Masonry Paint"" makes it ideal for coastal areas exposed to saltwater and high humidity?",4,Brand,Sandtex,It is fortified with silicone additives that repel water and prevent saltwater damage,It uses an ultra-thick coating that prevents any moisture from penetrating the surface,It includes a built-in anti-corrosion agent designed to protect metal surfaces from rust,"It incorporates a flexible polymer that expands and contracts with weather changes, preventing cracking",It is fortified with silicone additives that repel water and prevent saltwater damage
Can Sadolin Superdec be used to paint the treads of the timber stairs of a house?,3,Brand,Sadolin ,Not suitable for underfoot,Yes as long as a primer is used,"Yes, but it cant have any wax on the surface",No but can be used on decking ,Not suitable for underfoot
Whats important to do whilst using Sadolin PV67?,2,Brand,Sadolin ,Ventilate the area,Close all windows and doors,Do not wear PPE,Let the product dry,Ventilate the area
Osmo Polyx Oil Tints are often recommended for floors. Which of the following properties makes this product particularly suitable for high-traffic areas?,3,Brand,Osmo ,"The oil formula hardens over time, creating a strong, protective surface",It is designed to be easily re-applied in thin layers without sanding,It provides a finish that is smooth but vulnerable to scuff marks,"The tints provide a thick, water-resistant layer that is highly durable","The oil formula hardens over time, creating a strong, protective surface"
What would you recommend the Osmo wood wax finish extra thin for? ,1,Brand,Osmo,Hardwood ,Plywood,Softwood,Concrete,Hardwood 
What do I clean my brushes after using Osmo polyx oil ?,1,Brand,Osmo ,Osmo brush cleaner and thinner,Fiddes wood surface cleaner,Osmo tannin spot remover,Osmo intensive cleaner,Osmo brush cleaner and thinner
Can a customer use a steam cleaner or steam mop after using Osmo polyx oil? ,2,Brand,Osmo ,"No, not under any circumstances",Yes it is recommended by Osmo,"Yes, but only every month or so",No unless you put oil through the steam mop,"No, not under any circumstances"
Can Osmo Woodstain be applied to Thermowood and TMT cladding?,4,Brand,Osmo ,Yes it can ,Not recommended,Only the clear can be used,Only if you apply 4 coats ,Yes it can 
Someone has complained that they needed double the amount of Osmo WR base coat compared to the Osmo country colour. Explain why this could happen? ,3,Brand,Osmo ,This is normal due to the WR base coat having a lower coverage spread rate ,It sounds like they have put the incorrect measurements in ,They have the same coverage rate so complaint upheld,The base coat has a higher coverage rate ,This is normal due to the WR base coat having a lower coverage spread rate 
